{
  "bundle_path": "synthetic-tempdir/committed_bundle_copy",
  "evidence_id": "generated_image_provenance",
  "inventory": {
    "findings_empty": true,
    "ok": true,
    "path": "synthetic-tempdir/report/inventory.json",
    "relationships_external_count": 0,
    "slide_count": 2
  },
  "notes": {
    "embed_surface": "PNG, JPG, and JPEG inside the ppt media slot of the produced deck. The subset scripts export_pptx supports today; anything outside that subset is fail-closed by the exporter.",
    "scope": "Synthetic placeholder generated-image provenance template. Mock chain only. NOT real D-One, NOT MCP, NOT Qoder, NOT a public-network run, NOT telemetry, NOT a prompt or report to PPTX automation. Replace every placeholder value with what an actual local mock run produced; the runtime smoke writes the TEMP-ONLY object under a tempdir that is removed on exit and never commits."
  },
  "pptx_path": "synthetic-tempdir/output/trial.pptx",
  "real_d_one_status": "UNVERIFIED. Real D-One is NOT called by this provenance handoff. The PNG bytes embedded in the produced PPTX come from the in-script mock provider, not from any external service. No MCP, no public network, no model API, no image search, no Qoder, no telemetry.",
  "report_dir": "synthetic-tempdir/report",
  "rows": [
    {
      "asset": {
        "byte_count": 67,
        "error": "",
        "exists": true,
        "extension": "png",
        "media_type": "image/png",
        "path": "synthetic-tempdir/workspace/media/cover_accent.png",
        "sha256": "aaaaaaaaaaaaaaaaaaaaaaaaaaaaaaaaaaaaaaaaaaaaaaaaaaaaaaaaaaaaaaaa"
      },
      "id": "cover_accent",
      "manifest_local_path": "media/cover_accent.png",
      "placement_role": "hero_page",
      "pptx_media": {
        "content_type": "image/png",
        "extension": "png",
        "part": "ppt/media/image1.png",
        "referencing_slides": [1],
        "sha256": "aaaaaaaaaaaaaaaaaaaaaaaaaaaaaaaaaaaaaaaaaaaaaaaaaaaaaaaaaaaaaaaa",
        "size_bytes": 67
      },
      "sidecar": {
        "manifest_local_path": "media/cover_accent.png",
        "placement_role": "hero_page",
        "subject_domain": "abstract_geometry",
        "text_policy": "no_text"
      },
      "spec": {
        "intended_use": "hero-page accent",
        "placement_role": "hero_page",
        "subject_domain": "abstract_geometry",
        "text_policy": "no_text"
      },
      "subject_domain": "abstract_geometry",
      "text_policy": "no_text"
    },
    {
      "asset": {
        "byte_count": 67,
        "error": "",
        "exists": true,
        "extension": "png",
        "media_type": "image/png",
        "path": "synthetic-tempdir/workspace/media/system_schematic.png",
        "sha256": "bbbbbbbbbbbbbbbbbbbbbbbbbbbbbbbbbbbbbbbbbbbbbbbbbbbbbbbbbbbbbbbb"
      },
      "id": "system_schematic",
      "manifest_local_path": "media/system_schematic.png",
      "placement_role": "local_region",
      "pptx_media": {
        "content_type": "image/png",
        "extension": "png",
        "part": "ppt/media/image2.png",
        "referencing_slides": [2],
        "sha256": "bbbbbbbbbbbbbbbbbbbbbbbbbbbbbbbbbbbbbbbbbbbbbbbbbbbbbbbbbbbbbbbb",
        "size_bytes": 67
      },
      "sidecar": {
        "manifest_local_path": "media/system_schematic.png",
        "placement_role": "local_region",
        "subject_domain": "process_motif",
        "text_policy": "caption_safe"
      },
      "spec": {
        "intended_use": "local-region schematic",
        "placement_role": "local_region",
        "subject_domain": "process_motif",
        "text_policy": "caption_safe"
      },
      "subject_domain": "process_motif",
      "text_policy": "caption_safe"
    }
  ],
  "schema_version": "1",
  "sidecar": {
    "path": "synthetic-tempdir/report/mock_d_one_adapter_plan.json",
    "request_count": 2,
    "schema_version": 4
  },
  "summary": {
    "failures": [],
    "ok": true,
    "placement_role_coverage": ["hero_page", "local_region"],
    "row_count": 2,
    "text_policy_coverage": ["caption_safe", "no_text"]
  },
  "workspace_path": "synthetic-tempdir/workspace"
}
